{
  "schema_version": "pa_feitian_evaluation_dataset_v1",
  "generated_at_utc": "2026-07-11T12:05:00Z",
  "provenance": {
    "role": "m6_evaluation_dataset",
    "source_manifest_path": "doc/repro/pa-feitian-m6-data-quality-recovery-2026-07-11/source/pa_feitian_run_manifest_candidate_stop_30pct_v1.json",
    "source_manifest_sha256": "sha256:ed43e72651426a2ddc5938aa0f6a64fcaac44496884bec864388495b1833ad09",
    "source_manifest_schema_version": "pa_feitian_run_manifest_v1",
    "premium_outcome_artifact_path": "doc/repro/pa-feitian-m6-data-quality-recovery-2026-07-11/source/pa_feitian_premium_outcome_candidate_stop_30pct_v1.json",
    "premium_outcome_artifact_sha256": "sha256:e3270e76178870dabf2f97424f4a01db93604d64458ee3c44eb4a0ed5f8a7d01",
    "premium_outcome_schema_version": "pa_feitian_premium_outcome_v1",
    "source_commit": "67096c3c384e7bbcfda9721b7f36d8fe782801a2",
    "producer": "engine.pa_feitian.baseline_evaluator.v1",
    "cli_args": [
      "src/scripts/evaluate_pa_feitian_m6_baseline.py",
      "--m5-manifest",
      "doc/repro/pa-feitian-m6-data-quality-recovery-2026-07-11/source/pa_feitian_run_manifest_candidate_stop_30pct_v1.json",
      "--premium-outcome",
      "doc/repro/pa-feitian-m6-data-quality-recovery-2026-07-11/source/pa_feitian_premium_outcome_candidate_stop_30pct_v1.json",
      "--decision-intent",
      "doc/repro/pa-feitian-m4b-real-data-artifacts-2026-07-10/source/pa_feitian_decision_intent_v1.json",
      "--dataset-out",
      "doc/repro/pa-feitian-m6-data-quality-recovery-2026-07-11/source/pa_feitian_evaluation_dataset_candidate_stop_30pct_v1.json",
      "--aggregate-out",
      "doc/repro/pa-feitian-m6-data-quality-recovery-2026-07-11/source/pa_feitian_evaluation_aggregate_result_candidate_stop_30pct_v1.json",
      "--manifest-out",
      "doc/repro/pa-feitian-m6-data-quality-recovery-2026-07-11/source/pa_feitian_run_manifest_candidate_stop_30pct_evaluation_v1.json",
      "--generated-at-utc",
      "2026-07-11T12:05:00Z",
      "--seed",
      "7",
      "--bootstrap-replicates",
      "1000",
      "--lower-quantile",
      "0.05",
      "--minimum-effective-samples",
      "3",
      "--folds",
      "2",
      "--minimum-train-events",
      "1",
      "--timezone",
      "UTC",
      "--trading-calendar",
      "XSGE"
    ],
    "policy_config_sha256": "sha256:f278a4dbe13d3899ff8043d3ff0a704364e01dbf2f4dbc2b1842b3e2fa4ee71f",
    "data_access_status": "real_data_available",
    "fixture_fallback": false,
    "random_seed": 7,
    "input_hashes": {
      "source_manifest": "sha256:ed43e72651426a2ddc5938aa0f6a64fcaac44496884bec864388495b1833ad09",
      "premium_outcome_artifact": "sha256:e3270e76178870dabf2f97424f4a01db93604d64458ee3c44eb4a0ed5f8a7d01",
      "decision_intent_artifact": "sha256:340611f099007d06754a205b99c0cd7c7de989360e428a8036528486fcd711f0",
      "policy_config": "sha256:f278a4dbe13d3899ff8043d3ff0a704364e01dbf2f4dbc2b1842b3e2fa4ee71f"
    },
    "output_hashes": {},
    "notes": [
      "M6-B consumed explicit M5 manifest, premium-outcome, and decision-intent artifacts only",
      "no score_today rerun, market scan, contract reselection, live trading, or execution occurred"
    ]
  },
  "time_boundary": {
    "timezone": "UTC",
    "trading_calendar": "XSGE",
    "decision_start_utc": "2026-03-13T00:00:00Z",
    "decision_end_utc": "2026-06-02T00:00:00Z",
    "split_method": "walk_forward",
    "folds_declared": 2
  },
  "rows": [
    {
      "row_id": "m6:paft_premium_outcome_0001_paft_scorecard_0001_kq_m_shfe_au_20260313000000_daily_v1",
      "event_id": "event:paft_scorecard_0001_kq_m_shfe_au_20260313000000",
      "outcome_id": "paft_premium_outcome_0001_paft_scorecard_0001_kq_m_shfe_au_20260313000000_daily_v1",
      "source_signal_id": "paft_scorecard_0001_kq_m_shfe_au_20260313000000",
      "source_contract_id": "scorecard_record:1:options_calls:0",
      "decision_ts_utc": "2026-03-13T00:00:00Z",
      "pool": "unknown",
      "underlying": "SHFE.au",
      "decision_state": "watch",
      "decision_trace_node_ids": [],
      "iv_gate_status": "unknown",
      "option_type": "call",
      "contract_family": "au_monthly_call",
      "moneyness_bucket": "unknown",
      "policy_id": "pa_feitian_m6_daily_long_option_stop_30pct",
      "policy_version": "v1.retro_20260711",
      "policy_sha256": "sha256:2a2de67bcfab7841606fdf5c98a79f623e93b988a20414ee68904a48b2bebdce",
      "evaluation_status": "observed",
      "exit_reason": "premium_stop",
      "premium_r": -1.0,
      "underlying_r": null,
      "premium_mfe": 0.024811219,
      "premium_mae": -0.7403811579,
      "input_refs": [
        "scorecard_record:1",
        "snapshot_signal:paft_scorecard_0001_kq_m_shfe_au_20260313000000"
      ]
    },
    {
      "row_id": "m6:paft_premium_outcome_0002_paft_scorecard_0002_kq_m_shfe_au_20260318000000_daily_v1",
      "event_id": "event:paft_scorecard_0002_kq_m_shfe_au_20260318000000",
      "outcome_id": "paft_premium_outcome_0002_paft_scorecard_0002_kq_m_shfe_au_20260318000000_daily_v1",
      "source_signal_id": "paft_scorecard_0002_kq_m_shfe_au_20260318000000",
      "source_contract_id": "scorecard_record:2:options_calls:0",
      "decision_ts_utc": "2026-03-18T00:00:00Z",
      "pool": "unknown",
      "underlying": "SHFE.au",
      "decision_state": "watch",
      "decision_trace_node_ids": [],
      "iv_gate_status": "unknown",
      "option_type": "call",
      "contract_family": "au_monthly_call",
      "moneyness_bucket": "unknown",
      "policy_id": "pa_feitian_m6_daily_long_option_stop_30pct",
      "policy_version": "v1.retro_20260711",
      "policy_sha256": "sha256:2a2de67bcfab7841606fdf5c98a79f623e93b988a20414ee68904a48b2bebdce",
      "evaluation_status": "observed",
      "exit_reason": "time_exit",
      "premium_r": -0.3660006889,
      "underlying_r": null,
      "premium_mfe": 0.0760869565,
      "premium_mae": -0.6231884058,
      "input_refs": [
        "scorecard_record:2",
        "snapshot_signal:paft_scorecard_0002_kq_m_shfe_au_20260318000000"
      ]
    },
    {
      "row_id": "m6:paft_premium_outcome_0003_paft_scorecard_0003_kq_m_shfe_ag_20260515000000_daily_v1",
      "event_id": "event:paft_scorecard_0003_kq_m_shfe_ag_20260515000000",
      "outcome_id": "paft_premium_outcome_0003_paft_scorecard_0003_kq_m_shfe_ag_20260515000000_daily_v1",
      "source_signal_id": "paft_scorecard_0003_kq_m_shfe_ag_20260515000000",
      "source_contract_id": "scorecard_record:3:options_calls:0",
      "decision_ts_utc": "2026-05-15T00:00:00Z",
      "pool": "unknown",
      "underlying": "SHFE.ag",
      "decision_state": "watch",
      "decision_trace_node_ids": [],
      "iv_gate_status": "unknown",
      "option_type": "call",
      "contract_family": "ag_monthly_call",
      "moneyness_bucket": "unknown",
      "policy_id": "pa_feitian_m6_daily_long_option_stop_30pct",
      "policy_version": "v1.retro_20260711",
      "policy_sha256": "sha256:beae5088d473c8d0e61a1c0c5954e1ff4547962035be0ff961ae16d3894d8db8",
      "evaluation_status": "observed",
      "exit_reason": "premium_stop",
      "premium_r": -1.0,
      "underlying_r": null,
      "premium_mfe": -0.0009861933,
      "premium_mae": -0.7662721893,
      "input_refs": [
        "scorecard_record:3",
        "snapshot_signal:paft_scorecard_0003_kq_m_shfe_ag_20260515000000"
      ]
    },
    {
      "row_id": "m6:paft_premium_outcome_0004_paft_scorecard_0004_kq_m_shfe_ag_20260602000000_daily_v1",
      "event_id": "event:paft_scorecard_0004_kq_m_shfe_ag_20260602000000",
      "outcome_id": "paft_premium_outcome_0004_paft_scorecard_0004_kq_m_shfe_ag_20260602000000_daily_v1",
      "source_signal_id": "paft_scorecard_0004_kq_m_shfe_ag_20260602000000",
      "source_contract_id": "scorecard_record:4:options_calls:0",
      "decision_ts_utc": "2026-06-02T00:00:00Z",
      "pool": "unknown",
      "underlying": "SHFE.ag",
      "decision_state": "reject",
      "decision_trace_node_ids": [],
      "iv_gate_status": "unknown",
      "option_type": "call",
      "contract_family": "ag_monthly_call",
      "moneyness_bucket": "unknown",
      "policy_id": "pa_feitian_m6_daily_long_option_stop_30pct",
      "policy_version": "v1.retro_20260711",
      "policy_sha256": "sha256:beae5088d473c8d0e61a1c0c5954e1ff4547962035be0ff961ae16d3894d8db8",
      "evaluation_status": "observed",
      "exit_reason": "premium_stop",
      "premium_r": -1.0,
      "underlying_r": null,
      "premium_mfe": -0.0008849558,
      "premium_mae": -0.9026548673,
      "input_refs": [
        "scorecard_record:4",
        "snapshot_signal:paft_scorecard_0004_kq_m_shfe_ag_20260602000000"
      ]
    }
  ],
  "filter_reason_counts": {},
  "warnings": [
    "IV gate and decision-trace nodes are unknown because the explicit M5 inputs do not carry M6 labels",
    "non-observed M5 statuses are retained and excluded from premium-R statistics"
  ]
}
