{
  "schema_version": "pa_feitian_evaluation_dataset_v1",
  "generated_at_utc": "2026-07-11T00:00:00Z",
  "provenance": {
    "role": "m6_evaluation_dataset",
    "source_manifest_path": "doc/repro/pa-feitian-m5-data-real-premium-outcomes-2026-07-10/source/pa_feitian_run_manifest_with_premium_outcome_v1.json",
    "source_manifest_sha256": "sha256:2a0b3bfdf2b1c605ba9f4d1817dbe74847d9b90c3786b51b96c69137c5d782a4",
    "source_manifest_schema_version": "pa_feitian_run_manifest_v1",
    "premium_outcome_artifact_path": "doc/repro/pa-feitian-m5-data-real-premium-outcomes-2026-07-10/source/pa_feitian_premium_outcome_v1.json",
    "premium_outcome_artifact_sha256": "sha256:addc74e48d19b9e437f639ff336f9fa0c1c1c0b5a1bdea9511be88087fe8149e",
    "premium_outcome_schema_version": "pa_feitian_premium_outcome_v1",
    "source_commit": "5c74dd4964c814f1daefa09dc9f45ac3bfcc5788",
    "producer": "engine.pa_feitian.baseline_evaluator.v1",
    "cli_args": [
      "src/scripts/evaluate_pa_feitian_m6_baseline.py",
      "--m5-manifest",
      "doc/repro/pa-feitian-m5-data-real-premium-outcomes-2026-07-10/source/pa_feitian_run_manifest_with_premium_outcome_v1.json",
      "--premium-outcome",
      "doc/repro/pa-feitian-m5-data-real-premium-outcomes-2026-07-10/source/pa_feitian_premium_outcome_v1.json",
      "--decision-intent",
      "doc/repro/pa-feitian-m4b-real-data-artifacts-2026-07-10/source/pa_feitian_decision_intent_v1.json",
      "--dataset-out",
      "doc/repro/pa-feitian-m6-real-evidence-2026-07-11/source/pa_feitian_evaluation_dataset_baseline_v1.json",
      "--aggregate-out",
      "doc/repro/pa-feitian-m6-real-evidence-2026-07-11/source/pa_feitian_evaluation_aggregate_result_baseline_v1.json",
      "--manifest-out",
      "doc/repro/pa-feitian-m6-real-evidence-2026-07-11/source/pa_feitian_run_manifest_baseline_evaluation_v1.json",
      "--generated-at-utc",
      "2026-07-11T00:00:00Z",
      "--seed",
      "7",
      "--bootstrap-replicates",
      "1000",
      "--lower-quantile",
      "0.05",
      "--minimum-effective-samples",
      "3",
      "--folds",
      "2",
      "--minimum-train-events",
      "1",
      "--timezone",
      "UTC",
      "--trading-calendar",
      "XSGE"
    ],
    "policy_config_sha256": "sha256:f278a4dbe13d3899ff8043d3ff0a704364e01dbf2f4dbc2b1842b3e2fa4ee71f",
    "data_access_status": "real_data_available",
    "fixture_fallback": false,
    "random_seed": 7,
    "input_hashes": {
      "source_manifest": "sha256:2a0b3bfdf2b1c605ba9f4d1817dbe74847d9b90c3786b51b96c69137c5d782a4",
      "premium_outcome_artifact": "sha256:addc74e48d19b9e437f639ff336f9fa0c1c1c0b5a1bdea9511be88087fe8149e",
      "decision_intent_artifact": "sha256:340611f099007d06754a205b99c0cd7c7de989360e428a8036528486fcd711f0",
      "policy_config": "sha256:f278a4dbe13d3899ff8043d3ff0a704364e01dbf2f4dbc2b1842b3e2fa4ee71f"
    },
    "output_hashes": {},
    "notes": [
      "M6-B consumed explicit M5 manifest, premium-outcome, and decision-intent artifacts only",
      "no score_today rerun, market scan, contract reselection, live trading, or execution occurred"
    ]
  },
  "time_boundary": {
    "timezone": "UTC",
    "trading_calendar": "XSGE",
    "decision_start_utc": "2026-03-13T00:00:00Z",
    "decision_end_utc": "2026-06-02T00:00:00Z",
    "split_method": "walk_forward",
    "folds_declared": 2
  },
  "rows": [
    {
      "row_id": "m6:paft_premium_outcome_0001_paft_scorecard_0001_kq_m_shfe_au_20260313000000_daily_v1",
      "event_id": "event:paft_scorecard_0001_kq_m_shfe_au_20260313000000",
      "outcome_id": "paft_premium_outcome_0001_paft_scorecard_0001_kq_m_shfe_au_20260313000000_daily_v1",
      "source_signal_id": "paft_scorecard_0001_kq_m_shfe_au_20260313000000",
      "source_contract_id": "scorecard_record:1:options_calls:0",
      "decision_ts_utc": "2026-03-13T00:00:00Z",
      "pool": "unknown",
      "underlying": "SHFE.au",
      "decision_state": "watch",
      "decision_trace_node_ids": [],
      "iv_gate_status": "unknown",
      "option_type": "call",
      "contract_family": "au_monthly_call",
      "moneyness_bucket": "unknown",
      "policy_id": "pa_feitian_m5_daily_long_option_stop_target",
      "policy_version": "v1.default",
      "policy_sha256": "sha256:856101f0b80f66b6118aa21db8cfb650e6a551fae80d051d71359a0d5358b9ca",
      "evaluation_status": "observed",
      "exit_reason": "premium_stop",
      "premium_r": -1.0,
      "underlying_r": null,
      "premium_mfe": 0.024811219,
      "premium_mae": -0.5800071917,
      "input_refs": [
        "scorecard_record:1",
        "snapshot_signal:paft_scorecard_0001_kq_m_shfe_au_20260313000000"
      ]
    },
    {
      "row_id": "m6:paft_premium_outcome_0002_paft_scorecard_0002_kq_m_shfe_au_20260318000000_daily_v1",
      "event_id": "event:paft_scorecard_0002_kq_m_shfe_au_20260318000000",
      "outcome_id": "paft_premium_outcome_0002_paft_scorecard_0002_kq_m_shfe_au_20260318000000_daily_v1",
      "source_signal_id": "paft_scorecard_0002_kq_m_shfe_au_20260318000000",
      "source_contract_id": "scorecard_record:2:options_calls:0",
      "decision_ts_utc": "2026-03-18T00:00:00Z",
      "pool": "unknown",
      "underlying": "SHFE.au",
      "decision_state": "watch",
      "decision_trace_node_ids": [],
      "iv_gate_status": "unknown",
      "option_type": "call",
      "contract_family": "au_monthly_call",
      "moneyness_bucket": "unknown",
      "policy_id": "pa_feitian_m5_daily_long_option_stop_target",
      "policy_version": "v1.default",
      "policy_sha256": "sha256:856101f0b80f66b6118aa21db8cfb650e6a551fae80d051d71359a0d5358b9ca",
      "evaluation_status": "observed",
      "exit_reason": "premium_stop",
      "premium_r": -1.0036144578,
      "underlying_r": null,
      "premium_mfe": 0.0760869565,
      "premium_mae": -0.5018115942,
      "input_refs": [
        "scorecard_record:2",
        "snapshot_signal:paft_scorecard_0002_kq_m_shfe_au_20260318000000"
      ]
    },
    {
      "row_id": "m6:paft_premium_outcome_0003_paft_scorecard_0003_kq_m_shfe_ag_20260515000000_daily_v1",
      "event_id": "event:paft_scorecard_0003_kq_m_shfe_ag_20260515000000",
      "outcome_id": "paft_premium_outcome_0003_paft_scorecard_0003_kq_m_shfe_ag_20260515000000_daily_v1",
      "source_signal_id": "paft_scorecard_0003_kq_m_shfe_ag_20260515000000",
      "source_contract_id": "scorecard_record:3:options_calls:0",
      "decision_ts_utc": "2026-05-15T00:00:00Z",
      "pool": "unknown",
      "underlying": "SHFE.ag",
      "decision_state": "watch",
      "decision_trace_node_ids": [],
      "iv_gate_status": "unknown",
      "option_type": "call",
      "contract_family": "ag_monthly_call",
      "moneyness_bucket": "unknown",
      "policy_id": "pa_feitian_m5_daily_long_option_stop_target",
      "policy_version": "v1.default",
      "policy_sha256": "sha256:5c6492207c2e717303fe415f32156ef4baf2a4192369faf8b8ceff81b0747046",
      "evaluation_status": "observed",
      "exit_reason": "premium_stop",
      "premium_r": -1.0,
      "underlying_r": null,
      "premium_mfe": -0.0009861933,
      "premium_mae": -0.5414201183,
      "input_refs": [
        "scorecard_record:3",
        "snapshot_signal:paft_scorecard_0003_kq_m_shfe_ag_20260515000000"
      ]
    },
    {
      "row_id": "m6:paft_premium_outcome_0004_paft_scorecard_0004_kq_m_shfe_ag_20260602000000_daily_v1",
      "event_id": "event:paft_scorecard_0004_kq_m_shfe_ag_20260602000000",
      "outcome_id": "paft_premium_outcome_0004_paft_scorecard_0004_kq_m_shfe_ag_20260602000000_daily_v1",
      "source_signal_id": "paft_scorecard_0004_kq_m_shfe_ag_20260602000000",
      "source_contract_id": "scorecard_record:4:options_calls:0",
      "decision_ts_utc": "2026-06-02T00:00:00Z",
      "pool": "unknown",
      "underlying": "SHFE.ag",
      "decision_state": "reject",
      "decision_trace_node_ids": [],
      "iv_gate_status": "unknown",
      "option_type": "call",
      "contract_family": "ag_monthly_call",
      "moneyness_bucket": "unknown",
      "policy_id": "pa_feitian_m5_daily_long_option_stop_target",
      "policy_version": "v1.default",
      "policy_sha256": "sha256:5c6492207c2e717303fe415f32156ef4baf2a4192369faf8b8ceff81b0747046",
      "evaluation_status": "observed",
      "exit_reason": "premium_stop",
      "premium_r": -1.0,
      "underlying_r": null,
      "premium_mfe": -0.0008849558,
      "premium_mae": -0.6623893805,
      "input_refs": [
        "scorecard_record:4",
        "snapshot_signal:paft_scorecard_0004_kq_m_shfe_ag_20260602000000"
      ]
    }
  ],
  "filter_reason_counts": {},
  "warnings": [
    "IV gate and decision-trace nodes are unknown because the explicit M5 inputs do not carry M6 labels",
    "non-observed M5 statuses are retained and excluded from premium-R statistics"
  ]
}
